{
    "imageStudyId": "",
    "disease": {
        "dateOfFirstTreatment": "",
        "diagnosis": {
            "id": "",
            "label": ""
        },
        "diseaseId": "",
        "imagingProcedureProtocol": {
            "id": "",
            "label": ""
        },
        "pathology": [
            {
                "id": "",
                "label": ""
            },
            {
                "id": "",
                "label": ""
            }
        ],
        "pathologyConfirmation": {
            "id": "",
            "label": ""
        },
        "treatment": [
            {
                "id": "",
                "label": ""
            },
            {
                "id": "",
                "label": ""
            }
        ],
        "tumorMetadata":{
    "tumorId": "",
    "tumorMarkerTestResult": {
        "id": "",
        "label": ""
    },
    "cancerStageCMCategory": {
        "id": "",
        "label": ""
    },
    "cancerStagePMCategory": {
        "id": "",
        "label": ""
    },
    "histologicGraceGleasonScore": {
        "id": "",
        "label": ""
    },
    "histologicGradeISUP": {
        "id": "",
        "label": ""
    },
    "tumorBIRADSAssesment": {
        "id": "",
        "label": ""
    },
    "tumorPIRADSAssesment": {
        "id": "",
        "label": ""
    }
},
        "yearOfDiagnosis": 0
    },
    "imageModality": {
        "id": "",
        "label": ""
    },
    "imageBodyPart": {
        "id": "",
        "label": ""
    },
    "imageManufacturer": {
        "id": "",
        "label": ""
    },
    "dateOfImageAcquisition": ""
}